[
	{
		"id": 1, 
		"title": "Party", 
		"exerciseType": "XML_DTD", 
		"fixedStart": "<?xml version=\"1.0\" encoding=\"UTF-8\"?>\n<!DOCTYPE party SYSTEM \"party.dtd\">", 
		"referenceFileName": "party", 
		"text": "Erstellen Sie zu dieser Document Type Definition ein passendes XML-Dokument."
	}, 
	{
		"id": 2, 
		"title": "Vorlesung", 
		"exerciseType": "XML_DTD", 
		"fixedStart": "<?xml version=\"1.0\" encoding=\"UTF-8\"?>\n<!DOCTYPE lecture SYSTEM \"lecture.dtd\">", 
		"referenceFileName": "lecture", 
		"text": "Erstellen Sie zu dieser DTD ein passendes XML-Dokument."
	}, 
	{
		"id": 3, 
		"title": "Fr端hst端ck", 
		"exerciseType": "DTD_XML", 
		"fixedStart": "", 
		"referenceFileName": "breakfast", 
		"text": "Erstellen Sie f端r dieses Dokument eine passende Document Type Definition."
	}, 
	{
		"id": 4, 
		"title": "Krankenhaus", 
		"exerciseType": "XML_DTD", 
		"fixedStart": "<?xml version=\"1.0\" encoding=\"UTF-8\"?>\n<!DOCTYPE krankenhaus SYSTEM \"hospital.dtd\">", 
		"referenceFileName": "hospital", 
		"text": "Erstellen Sie zu dieser DTD ein passendes XML-Dokument."
	}, 
	{
		"id": 5, 
		"title": "Bibliothek", 
		"exerciseType": "DTD_XML", 
		"fixedStart": "", 
		"referenceFileName": "bibliothek", 
		"text": "Erstellen Sie f端r dieses Dokument eine passende Document Type Definition."
	}
]